{
  "schemaVersion": "0",
  "channel": 2,
  "generatedAtUtc": "2026-10-01T10:30:00.000Z",
  "spans": [
    {
      "startUtc": "2026-10-01T10:00:00.000Z",
      "endUtc": "2026-10-01T10:12:30.000Z"
    },
    {
      "startUtc": "2026-10-01T10:13:00.000Z",
      "endUtc": "2026-10-01T10:30:00.000Z"
    }
  ]
}
